Sheet: Exercício 1
A1: Empresa Nacional S/A
A2: Código | B2: Produto | C2: Jan | D2: Fev | E2: Mar | F2: Total 1º Trim. | G2: Máximo | H2: Mínimo | I2: Média
A3: 1 | B3: Porca | C3: 4500 | D3: 5040 | E3: 5696 | F3: of:=SUM([.C3:.E3]) -> 15236 | G3: of:=MAX([.C3:.E3]) -> 5696 | H3: of:=MIN([.C3:.E3]) -> 4500 | I3: of:=AVERAGE([.C3:.E3]) -> 5078.66666666667
A4: 2 | B4: Parafuso | C4: 6250 | D4: 7000 | E4: 7910 | F4: of:=SUM([.C4:.E4]) -> 21160 | G4: of:=MAX([.C4:.E4]) -> 7910 | H4: of:=MIN([.C4:.E4]) -> 6250 | I4: of:=AVERAGE([.C4:.E4]) -> 7053.33333333333
A5: 3 | B5: Arruela | C5: 3300 | D5: 3696 | E5: 4176 | F5: of:=SUM([.C5:.E5]) -> 11172 | G5: of:=MAX([.C5:.E5]) -> 4176 | H5: of:=MIN([.C5:.E5]) -> 3300 | I5: of:=AVERAGE([.C5:.E5]) -> 3724
A6: 4 | B6: Prego | C6: 8000 | D6: 8690 | E6: 10125 | F6: of:=SUM([.C6:.E6]) -> 26815 | G6: of:=MAX([.C6:.E6]) -> 10125 | H6: of:=MIN([.C6:.E6]) -> 8000 | I6: of:=AVERAGE([.C6:.E6]) -> 8938.33333333333
A7: 5 | B7: Alicate | C7: 4557 | D7: 5104 | E7: 5676 | F7: of:=SUM([.C7:.E7]) -> 15337 | G7: of:=MAX([.C7:.E7]) -> 5676 | H7: of:=MIN([.C7:.E7]) -> 4557 | I7: of:=AVERAGE([.C7:.E7]) -> 5112.33333333333
A8: 6 | B8: Martelo | C8: 3260 | D8: 3640 | E8: 4113 | F8: of:=SUM([.C8:.E8]) -> 11013 | G8: of:=MAX([.C8:.E8]) -> 4113 | H8: of:=MIN([.C8:.E8]) -> 3260 | I8: of:=AVERAGE([.C8:.E8]) -> 3671
A9: Totais | B9: = | C9: of:=SUM([.C3:.C8]) -> 29867 | D9: of:=SUM([.D3:.D8]) -> 33170 | E9: of:=SUM([.E3:.E8]) -> 37696 | F9: 100733
A10: Total do 1 Semestre:
A20: Código | B20: Produto | C20: Abr | D20: Mai | E20: Jun | F20: Total 2º Trim. | G20: Máximo | H20: Mínimo | I20: Média
A21: 1 | B21: Porca | C21: 6265 | D21: 6954 | E21: 7858 | F21: of:=SUM([.C21:.E21]) -> 21077 | G21: of:=MAX([.C21:.E21]) -> 7858 | H21: of:=MIN([.C21:.E21]) -> 6265 | I21: of:=AVERAGE([.C21:.E21]) -> 7025.66666666667
A22: 2 | B22: Parafuso | C22: 8701 | D22: 9658 | E22: 10197 | F22: of:=SUM([.C22:.E22]) -> 28556 | G22: of:=MAX([.C22:.E22]) -> 10197 | H22: of:=MIN([.C22:.E22]) -> 8701 | I22: of:=AVERAGE([.C22:.E22]) -> 9518.66666666667
A23: 3 | B23: Arruela | C23: 4569 | D23: 5099 | E23: 5769 | F23: of:=SUM([.C23:.E23]) -> 15437 | G23: of:=MAX([.C23:.E23]) -> 5769 | H23: of:=MIN([.C23:.E23]) -> 4569 | I23: of:=AVERAGE([.C23:.E23]) -> 5145.66666666667
A24: 4 | B24: Prego | C24: 12341 | D24: 12365 | E24: 13969 | F24: of:=SUM([.C24:.E24]) -> 38675 | G24: of:=MAX([.C24:.E24]) -> 13969 | H24: of:=MIN([.C24:.E24]) -> 12341 | I24: of:=AVERAGE([.C24:.E24]) -> 12891.6666666667
A25: 5 | B25: Alicate | C25: 6344 | D25: 7042 | E25: 7957 | F25: of:=SUM([.C25:.E25]) -> 21343 | G25: of:=MAX([.C25:.E25]) -> 7957 | H25: of:=MIN([.C25:.E25]) -> 6344 | I25: of:=AVERAGE([.C25:.E25]) -> 7114.33333333333
A26: 6 | B26: Martelo | C26: 4525 | D26: 5022 | E26: 5671 | F26: of:=SUM([.C26:.E26]) -> 15218 | G26: of:=MAX([.C26:.E26]) -> 5671 | H26: of:=MIN([.C26:.E26]) -> 4525 | I26: of:=AVERAGE([.C26:.E26]) -> 5072.66666666667
A27: Totais | B27: = | C27: of:=SUM([.C21:.C26]) -> 42745 | D27: of:=SUM([.D21:.D26]) -> 46140 | E27: of:=SUM([.E21:.E26]) -> 51421 | F27: 140306
A28: Total do 2 Semestre:

Sheet: Exercício 2
A1: CONTAS A PAGAR
B2: JANEIRO | C2: FEVEREIRO | D2: MARÇO | E2: ABRIL | F2: MAIO | G2: JUNHO
A3: SALÁRIO | B3: 500 | C3: 750 | D3: 800 | E3: 700 | F3: 654 | G3: 700
A5: CONTAS
A6: ÁGUA | B6: 10 | C6: 15 | D6: 15 | E6: 12 | F6: 12 | G6: 11
A7: LUZ | B7: 50 | C7: 60 | D7: 54 | E7: 55 | F7: 54 | G7: 56
A8: ESCOLA | B8: 300 | C8: 250 | D8: 300 | E8: 300 | F8: 200 | G8: 200
A9: IPTU | B9: 40 | C9: 40 | D9: 40 | E9: 40 | F9: 40 | G9: 40
A10: IPVA | B10: 10 | C10: 15 | D10: 14 | E10: 15 | F10: 20 | G10: 31
A11: SHOPPING | B11: 120 | C11: 150 | D11: 130 | E11: 200 | F11: 150 | G11: 190
A12: COMBUSTÍVEL | B12: 50 | C12: 60 | D12: 65 | E12: 70 | F12: 65 | G12: 85
A13: ACADEMIA | B13: 145 | C13: 145 | D13: 145 | E13: 145 | F13: 100 | G13: 145
A14: TOTAL DE CONTAS | B14: of:=SUM([.B6:.B13]) -> 725 | C14: of:=SUM([.C6:.C13]) -> 735 | D14: of:=SUM([.D6:.D13]) -> 763 | E14: of:=SUM([.E6:.E13]) -> 837 | F14: of:=SUM([.F6:.F13]) -> 641 | G14: of:=SUM([.G6:.G13]) -> 758
A15: SALDO FINAL | B15: of:=([.B3]-[.B14]) -> -225 | C15: of:=([.C3]-[.C14]) -> 15 | D15: of:=([.D3]-[.D14]) -> 37 | E15: of:=([.E3]-[.E14]) -> -137 | F15: of:=([.F3]-[.F14]) -> 13 | G15: of:=([.G3]-[.G14]) -> -58

Sheet: Exercício 3
A1: Araras Informática - Hardware e Software
A2: Rua São Francisco de Assis, 123 – Resende - RJ
A3: Nº | B3: NOME | C3: Salário Bruto | D3: INSS | E3: Gratificação | F3: INSS R$ | G3: Gratificação R$ | H3: Salário Líquido
A4: 1 | B4: Eduardo | C4: 853 | D4: 0.1 | E4: 0.09 | F4: of:=([.C4]*[.D4]) -> 85.3 | G4: of:=([.C4]*[.E4]) -> 76.77 | H4: of:=([.C4]+[.G4]-[.F4]) -> 844.47
A5: 2 | B5: Maria | C5: 951 | D5: 0.0999 | E5: 0.08 | F5: of:=([.C5]*[.D5]) -> 95.0049 | G5: of:=([.C5]*[.E5]) -> 76.08 | H5: of:=([.C5]+[.G5]-[.F5]) -> 932.0751
A6: 3 | B6: Helena | C6: 456 | D6: 0.0864 | E6: 0.06 | F6: of:=([.C6]*[.D6]) -> 39.3984 | G6: of:=([.C6]*[.E6]) -> 27.36 | H6: of:=([.C6]+[.G6]-[.F6]) -> 443.9616
A7: 4 | B7: Gabriela | C7: 500 | D7: 0.085 | E7: 0.06 | F7: of:=([.C7]*[.D7]) -> 42.5 | G7: of:=([.C7]*[.E7]) -> 30 | H7: of:=([.C7]+[.G7]-[.F7]) -> 487.5
A8: 5 | B8: Edson | C8: 850 | D8: 0.0899 | E8: 0.07 | F8: of:=([.C8]*[.D8]) -> 76.415 | G8: of:=([.C8]*[.E8]) -> 59.5 | H8: of:=([.C8]+[.G8]-[.F8]) -> 833.085
A9: 6 | B9: Elisangela | C9: 459 | D9: 0.0625 | E9: 0.05 | F9: of:=([.C9]*[.D9]) -> 28.6875 | G9: of:=([.C9]*[.E9]) -> 22.95 | H9: of:=([.C9]+[.G9]-[.F9]) -> 453.2625
A10: 7 | B10: Regina | C10: 478 | D10: 0.0712 | E10: 0.05 | F10: of:=([.C10]*[.D10]) -> 34.0336 | G10: of:=([.C10]*[.E10]) -> 23.9 | H10: of:=([.C10]+[.G10]-[.F10]) -> 467.8664
A11: 8 | B11: Paulo | C11: 658 | D11: 0.0599 | E11: 0.04 | F11: of:=([.C11]*[.D11]) -> 39.4142 | G11: of:=([.C11]*[.E11]) -> 26.32 | H11: of:=([.C11]+[.G11]-[.F11]) -> 644.9058

Sheet: Exercício 4
A1: Valor do Dólar | B1: 2.94
A2: Papelaria Papel Branco
A3: Produtos | B3: Qtde | C3: Preço Unit. | D3: Total R$ | E3: Total US$
A4: Caneta Azul | B4: 500 | C4: 0.15 | D4: of:=([.C4]*[.B4]) -> 75 | E4: of:=([.D4]/[.$B$1]) -> 25.5102040816327
A5: Caneta Vermelha | B5: 750 | C5: 0.15 | D5: of:=([.C5]*[.B5]) -> 112.5 | E5: of:=([.D5]/[.$B$1]) -> 38.265306122449
A6: Caderno | B6: 250 | C6: 10 | D6: of:=([.C6]*[.B6]) -> 2500 | E6: of:=([.D6]/[.$B$1]) -> 850.340136054422
A7: Régua | B7: 310 | C7: 0.5 | D7: of:=([.C7]*[.B7]) -> 155 | E7: of:=([.D7]/[.$B$1]) -> 52.7210884353742
A8: Lápis | B8: 500 | C8: 0.1 | D8: of:=([.C8]*[.B8]) -> 50 | E8: of:=([.D8]/[.$B$1]) -> 17.0068027210884
A9: Papel Sulfite | B9: 1500 | C9: 2.5 | D9: of:=([.C9]*[.B9]) -> 3750 | E9: of:=([.D9]/[.$B$1]) -> 1275.51020408163
A10: Tinta Nanquim | B10: 190 | C10: 6 | D10: of:=([.C10]*[.B10]) -> 1140 | E10: of:=([.D10]/[.$B$1]) -> 387.755102040816

Sheet: Exercício 5
A1: Projeção para o ano de 2010
A2: Receita bruta | B2: Jan-Mar | C2: Abr-Jun | E2: Jul-Set | F2: Out-Dez | G2: Total do Ano
B3: 140000 | C3: 185000 | E3: 204100 | F3: 240000 | G3: of:=SUM([.B3:.F3]) -> 769100
A5: Despesa Líquida | B5: Jan-Mar | C5: Abr-Jun | E5: Jul-Set | F5: Out-Dez | G5: Total do Ano
A6: Salários | B6: 20000 | C6: 26000 | E6: 33800 | F6: 43940 | G6: of:=SUM([.B6:.F6]) -> 123740
A7: Juros | B7: 20000 | C7: 15600 | E7: 20280 | F7: 26364 | G7: of:=SUM([.B7:.F7]) -> 82244
A8: Aluguel | B8: 12000 | C8: 20930 | E8: 27209 | F8: 35371.7 | G8: of:=SUM([.B8:.F8]) -> 95510.7
A9: Propaganda | B9: 16100 | C9: 28870 | E9: 33631 | F9: 43720.3 | G9: of:=SUM([.B9:.F9]) -> 122321.3
A10: Suprimentos | B10: 19900 | C10: 39000 | E10: 50700 | F10: 65910 | G10: of:=SUM([.B10:.F10]) -> 175510
A11: Diversos | B11: 25000 | C11: 32500 | E11: 42250 | F11: 54925 | G11: of:=SUM([.B11:.F11]) -> 154675
A12: Total do Trim. | B12: of:=SUM([.B6:.B11]) -> 113000 | C12: of:=SUM([.C6:.C11]) -> 162900 | E12: of:=SUM([.E6:.E11]) -> 207870 | F12: of:=SUM([.F6:.F11]) -> 270231
A13: Receita líquida | B13: of:=([.B3]-[.B12]) -> 27000 | C13: of:=([.C3]-[.C12]) -> 22100 | E13: of:=([.E3]-[.E12]) -> -3770 | F13: of:=([.F3]-[.F12]) -> -30231
A14: Situação
A15: Prejuízo Total | B15: of:=IF([.B13]<1000 ) -> 0 | C15: of:=IF([.C13]<1000 ) -> 0 | E15: of:=IF([.E13]<1000 ) -> 1 | F15: of:=IF([.F13]<1000 ) -> 1
A16: Lucro médio | B16: of:=IF([.B13]<5000 ) -> 0 | C16: of:=IF([.C13]<5000 ) -> 0 | E16: of:=IF([.E13]<5000 ) -> 1 | F16: of:=IF([.F13]<5000 ) -> 1
A17: Lucro Total | B17: of:=IF([.B13]>5000 ) -> 1 | C17: of:=IF([.C13]>5000 ) -> 1 | E17: of:=IF([.E13]>5000 ) -> 0 | F17: of:=IF([.F13]>5000 ) -> 0
G19: Valor Acumulado do ano de despesas | J19: of:=SUM([.G6:.G11]) -> 754001